<?xml version="1.0" encoding="UTF-8"?>
<Usuario xmlns:xsi="http://www.w3.org/2001/XMLSchema-instance"
    xsi:noNamespaceSchemaLocation="../../../Servicios/Xsd/Usuario.xsd">
    <Nick>francisco</Nick>
    <Pass>profPort</Pass>
    <Datas>
        <Name>Francisco</Name>
        <SurName>Cabrera</SurName>
        <FullAddress>c/Competa s/n, 29006 Málaga</FullAddress>
        <Phone>655472596</Phone>
        <Latitude>36.719313253453656</Latitude>
        <Longitude>36.719313253453656</Longitude>
    </Datas>
</Usuario>