<?xml version="1.0" encoding="UTF-8"?>
<Usuario xmlns:xsi="http://www.w3.org/2001/XMLSchema-instance"
 xsi:noNamespaceSchemaLocation="../../../Servicios/Xsd/Usuario.xsd">
    <Nick>rafa</Nick>
    <Pass>alumRaf</Pass>
    <Datas>
        <Name>Rafael</Name>
        <SurName>Bonilla</SurName>
        <FullAddress>c/Medina Azahara 45 Arroyo de la Miel, 29631</FullAddress>
        <Phone>65524877</Phone>
        <Email>rafabonilla@gmail.com</Email>
        <Latitude>36.602621769643726</Latitude>
        <Longitude>-4.528972348808231</Longitude>
    </Datas>
</Usuario>
